{
  "schemaVersion": "1.1",
  "scenarioId": "scenario-007-program-wide-plateau",
  "requiredObservations": [
    { "type": "performance_plateau", "scope": "exercise", "exerciseId": "barbell-squat", "onsetWeek": { "min": 1, "max": 3 }, "throughWeek": 6, "confidence": ["high"] },
    { "type": "performance_plateau", "scope": "exercise", "exerciseId": "barbell-bench-press", "onsetWeek": { "min": 1, "max": 3 }, "throughWeek": 6, "confidence": ["high"] },
    { "type": "performance_plateau", "scope": "exercise", "exerciseId": "barbell-row", "onsetWeek": { "min": 1, "max": 3 }, "throughWeek": 6, "confidence": ["high"] },
    { "type": "performance_plateau", "scope": "program", "onsetWeek": { "min": 1, "max": 3 }, "throughWeek": 6, "confidence": ["high"], "requiredEvidence": [{ "exerciseId": "barbell-squat", "metric": "maxWeightKg", "trend": ["stable"] }, { "exerciseId": "barbell-bench-press", "metric": "maxWeightKg", "trend": ["stable"] }, { "exerciseId": "barbell-row", "metric": "maxWeightKg", "trend": ["stable"] }] }
  ],
  "forbiddenObservations": [],
  "hypothesisPolicy": { "allowed": [{ "type": "insufficient_evidence", "confidence": ["low", "medium", "high"] }] },
  "recommendationPolicy": { "required": [{ "typeAnyOf": ["adjust_progression", "deload", "modify_volume", "modify_intensity", "review_recovery"], "exerciseId": null, "priorityAnyOf": ["medium", "high"] }], "forbidden": [] },
  "requiredLimitations": ["missing_recovery_data", "missing_nutrition_intake_data", "missing_technique_data"],
  "claimPolicy": { "forbiddenClaims": ["Fatigue, recovery, nutrition, or technique is a confirmed cause of the plateau.", "Stable body weight proves that nutrition is sufficient."] }
}
